{"changed_columns": [{"change_kind": "removed", "column": "customer_lifetime_value", "dataset_urn": "urn:li:dataset:(urn:li:dataPlatform:duckdb,blast_radius_demo.main.dim_customers,PROD)", "downstream_count": 3, "severity_level": "high", "severity_score": 61.0}], "detected_at": "2026-08-08T06:55:52Z", "downstream_entity_count": 3, "downstream_urns": ["urn:li:dataset:(urn:li:dataPlatform:dbt,blast_radius_demo.main.customer_ltv,PROD)", "urn:li:dataset:(urn:li:dataPlatform:dbt,blast_radius_demo.main.mart_exec_summary,PROD)", "urn:li:dataset:(urn:li:dataPlatform:duckdb,blast_radius_demo.main.customer_ltv,PROD)"], "pr_number": 1, "pr_url": "https://github.com/Varshavia/blast-radius/pull/1", "repo": "Varshavia/blast-radius", "schema_version": "1.0.0", "severity": {"level": "high", "rule_version": "sev-v1", "score": 61.0}, "status": "detected", "structured_property_urn": "urn:li:structuredProperty:io.blastradius.impactRecord", "tool": {"name": "blast-radius", "severity_rule_version": "sev-v1", "version": "0.1.0"}}